[
  {
    "id": "demo-ausstellung-kommend",
    "venueId": "makk-koeln",
    "festivalId": null,
    "title": "[Demo] Kommende Schau",
    "startDate": "2026-11-20",
    "endDate": "2027-02-14",
    "type": "solo",
    "photographerIds": [
      "demo-anna-beispiel"
    ],
    "description": "Eine fiktive Einzelausstellung, die erst in einigen Wochen beginnt."
  },
  {
    "id": "demo-ausstellung-laufend",
    "venueId": "kunstpalast-duesseldorf",
    "festivalId": null,
    "title": "[Demo] Laufende Gruppenschau",
    "startDate": "2026-09-01",
    "endDate": "2027-01-10",
    "type": "group",
    "photographerIds": [
      "demo-anna-beispiel",
      "demo-bruno-muster",
      "demo-clara-probe"
    ],
    "description": "Eine fiktive Gruppenausstellung, die noch lange läuft."
  },
  {
    "id": "demo-ausstellung-endet-bald",
    "venueId": "photographische-sammlung-koeln",
    "festivalId": null,
    "title": "[Demo] Schau mit nahem Ende",
    "startDate": "2026-08-15",
    "endDate": "2026-11-05",
    "type": "group",
    "photographerIds": [
      "demo-bruno-muster",
      "demo-david-test"
    ],
    "description": "Eine fiktive Ausstellung, die in wenigen Tagen schließt."
  },
  {
    "id": "demo-ausstellung-endet-in-14-tagen",
    "venueId": "museum-folkwang-essen",
    "festivalId": null,
    "title": "[Demo] Ende in vierzehn Tagen",
    "startDate": "2026-09-10",
    "endDate": "2026-11-10",
    "type": "retrospective",
    "photographerIds": [
      "demo-clara-probe"
    ],
    "description": "Eine fiktive Retrospektive an der Grenze der Kennzeichnung."
  },
  {
    "id": "demo-ausstellung-beendet",
    "venueId": "nrw-forum-duesseldorf",
    "festivalId": null,
    "title": "[Demo] Beendete Schau",
    "startDate": "2026-03-01",
    "endDate": "2026-06-30",
    "type": "solo",
    "photographerIds": [
      "demo-bruno-muster"
    ],
    "description": "Eine fiktive Ausstellung, die bereits vorbei ist."
  },
  {
    "id": "demo-ausstellung-festival-1",
    "venueId": "museum-ludwig-koeln",
    "festivalId": "demo-photoszene-beispiel",
    "title": "[Demo] Festival-Schau eins",
    "startDate": "2026-11-01",
    "endDate": "2026-12-15",
    "type": "group",
    "photographerIds": [
      "demo-anna-beispiel",
      "demo-felix-attrappe"
    ],
    "description": "Teil eines fiktiven Festivals."
  },
  {
    "id": "demo-ausstellung-festival-2",
    "venueId": "galerie-lichtblick-koeln",
    "festivalId": "demo-photoszene-beispiel",
    "title": "[Demo] Festival-Schau zwei",
    "startDate": "2026-11-01",
    "endDate": "2026-12-15",
    "type": "solo",
    "photographerIds": [
      "demo-david-test"
    ],
    "description": "Zweiter Teil des fiktiven Festivals."
  },
  {
    "id": "demo-ausstellung-dauerhaft",
    "venueId": "ruhr-museum-essen",
    "festivalId": null,
    "title": "[Demo] Dauerpräsentation",
    "startDate": "2025-01-01",
    "endDate": "2030-12-31",
    "type": "permanent",
    "photographerIds": [
      "demo-felix-attrappe"
    ],
    "description": "Eine fiktive Dauerausstellung."
  }
]
